{
  "id": "G-0412",
  "subject": "SANDWORM",
  "predicate": "MALWARE_NOTPETYA_ATTRIBUITO",
  "object": "UA",
  "relation_class": "intelligence",
  "evidence_level": "E2",
  "evidence_status": "institutional_attribution",
  "events": [
    "TL-0013"
  ],
  "valid_from": null,
  "valid_to": null,
  "primary_url": null,
  "caveat": null,
  "sources": [
    "S03"
  ],
  "review": {
    "status": "imported_unreviewed",
    "notes": []
  },
  "provenance": [
    {
      "file": "sources/original/Fonte_07_Ragnatela_Attori_Interessi_Relazioni_Europa_2026-10-21_archi.csv",
      "row": 410,
      "original": {
        "id": "G-0412",
        "source": "SANDWORM",
        "target": "UA",
        "predicate": "MALWARE_NOTPETYA_ATTRIBUITO",
        "relation_class": "intelligence",
        "evidence_level": "E2",
        "evidence_status": "attribuzione_istituzionale",
        "source_docs": "S03",
        "timeline_ids": "TL-0013",
        "date_start": "",
        "date_end": "",
        "primary_url": "",
        "layer": "source",
        "description_or_caveat": ""
      }
    }
  ]
}
