{
  "id": "G-0051",
  "subject": "PEGASUS",
  "predicate": "COMPROMISSIONE_FORMALE_FORENSE",
  "object": "KOUL",
  "relation_class": "surveillance",
  "evidence_level": "E3",
  "evidence_status": "corroborated",
  "events": [
    "TL-0111"
  ],
  "valid_from": null,
  "valid_to": null,
  "primary_url": "https://citizenlab.ca/research/",
  "caveat": {
    "it": "Operatore mandante non identificato"
  },
  "sources": [
    "S00",
    "S04",
    "S05"
  ],
  "review": {
    "status": "imported_unreviewed",
    "notes": []
  },
  "provenance": [
    {
      "file": "sources/original/Fonte_07_Ragnatela_Attori_Interessi_Relazioni_Europa_2026-10-21_archi.csv",
      "row": 50,
      "original": {
        "id": "G-0051",
        "source": "PEGASUS",
        "target": "KOUL",
        "predicate": "COMPROMISSIONE_FORMALE_FORENSE",
        "relation_class": "surveillance",
        "evidence_level": "E3",
        "evidence_status": "corroborato",
        "source_docs": "S00,S04,S05",
        "timeline_ids": "TL-0111",
        "date_start": "",
        "date_end": "",
        "primary_url": "https://citizenlab.ca/research/",
        "layer": "source",
        "description_or_caveat": "Operatore mandante non identificato"
      }
    }
  ]
}
