{
  "id": "G-0427",
  "subject": "OILMARKET",
  "predicate": "INFLUISCE_SU_PREZZI_2026",
  "object": "EUENERGY",
  "relation_class": "consequence",
  "evidence_level": "E3",
  "evidence_status": "corroborated",
  "events": [
    "TL-0122",
    "TL-0140"
  ],
  "valid_from": null,
  "valid_to": null,
  "primary_url": null,
  "caveat": {
    "it": "Meccanismo macro, non imputazione singoli scioperi",
    "en": "Macro mechanism, not attribution of individual strikes"
  },
  "sources": [
    "S04",
    "S05"
  ],
  "review": {
    "status": "imported_unreviewed",
    "notes": [],
    "translations": {
      "en": {
        "status": "machine",
        "source_hash": "ea0a92813e242150"
      }
    }
  },
  "provenance": [
    {
      "file": "sources/original/Fonte_07_Ragnatela_Attori_Interessi_Relazioni_Europa_2026-10-21_archi.csv",
      "row": 425,
      "original": {
        "id": "G-0427",
        "source": "OILMARKET",
        "target": "EUENERGY",
        "predicate": "INFLUISCE_SU_PREZZI_2026",
        "relation_class": "consequence",
        "evidence_level": "E3",
        "evidence_status": "corroborato",
        "source_docs": "S04,S05",
        "timeline_ids": "TL-0122;TL-0140",
        "date_start": "",
        "date_end": "",
        "primary_url": "",
        "layer": "source",
        "description_or_caveat": "Meccanismo macro, non imputazione singoli scioperi"
      }
    }
  ]
}
