{
  "id": "G-0114",
  "subject": "RU",
  "predicate": "POLITICAL_CONTEXT_NOT_ATTRIBUTION",
  "object": "TL-0001",
  "relation_class": "event_participation",
  "evidence_level": "E3",
  "evidence_status": "corroborated",
  "events": [
    "TL-0001"
  ],
  "valid_from": null,
  "valid_to": null,
  "primary_url": null,
  "caveat": {
    "it": "Relazione di presenza/ruolo rispetto al record cronologico. Non inferisce di per sé coordinamento con altri attori.",
    "en": "Presence/role relationship with respect to the chronological record. It does not by itself infer coordination with other actors."
  },
  "sources": [
    "S06",
    "S00",
    "S03",
    "S05"
  ],
  "review": {
    "status": "imported_unreviewed",
    "notes": [],
    "translations": {
      "en": {
        "status": "machine",
        "source_hash": "3a020bf03353aa3c"
      }
    }
  },
  "provenance": [
    {
      "file": "sources/original/Fonte_07_Ragnatela_Attori_Interessi_Relazioni_Europa_2026-10-21_archi.csv",
      "row": 112,
      "original": {
        "id": "G-0114",
        "source": "RU",
        "target": "EV_TL-0001",
        "predicate": "POLITICAL_CONTEXT_NOT_ATTRIBUTION",
        "relation_class": "event_participation",
        "evidence_level": "E3",
        "evidence_status": "corroborato",
        "source_docs": "S06;S06,S00;S03;S05",
        "timeline_ids": "TL-0001",
        "date_start": "",
        "date_end": "",
        "primary_url": "",
        "layer": "timeline_link",
        "description_or_caveat": "Relazione di presenza/ruolo rispetto al record cronologico. Non inferisce di per sé coordinamento con altri attori."
      }
    }
  ]
}
