{
  "id": "G-0350",
  "subject": "NATO",
  "predicate": "REPORTER",
  "object": "TL-0123",
  "relation_class": "event_participation",
  "evidence_level": "E1",
  "evidence_status": "documented",
  "events": [
    "TL-0123"
  ],
  "valid_from": null,
  "valid_to": null,
  "primary_url": null,
  "caveat": {
    "it": "Relazione di presenza/ruolo rispetto al record cronologico. Non inferisce di per sé coordinamento con altri attori."
  },
  "sources": [
    "S06",
    "S03"
  ],
  "review": {
    "status": "imported_unreviewed",
    "notes": []
  },
  "provenance": [
    {
      "file": "sources/original/Fonte_07_Ragnatela_Attori_Interessi_Relazioni_Europa_2026-10-21_archi.csv",
      "row": 348,
      "original": {
        "id": "G-0350",
        "source": "NATO",
        "target": "EV_TL-0123",
        "predicate": "REPORTER",
        "relation_class": "event_participation",
        "evidence_level": "E1",
        "evidence_status": "documentato",
        "source_docs": "S06;S06,S03",
        "timeline_ids": "TL-0123",
        "date_start": "",
        "date_end": "",
        "primary_url": "",
        "layer": "timeline_link",
        "description_or_caveat": "Relazione di presenza/ruolo rispetto al record cronologico. Non inferisce di per sé coordinamento con altri attori."
      }
    }
  ]
}
