{
  "id": "G-0122",
  "subject": "UA",
  "predicate": "VICTIM",
  "object": "TL-0006",
  "relation_class": "event_participation",
  "evidence_level": "E3",
  "evidence_status": "corroborated",
  "events": [
    "TL-0006"
  ],
  "valid_from": null,
  "valid_to": null,
  "primary_url": null,
  "caveat": {
    "it": "Relazione di presenza/ruolo rispetto al record cronologico. Non inferisce di per sé coordinamento con altri attori."
  },
  "sources": [
    "S06",
    "S00",
    "S03",
    "S05"
  ],
  "review": {
    "status": "imported_unreviewed",
    "notes": []
  },
  "provenance": [
    {
      "file": "sources/original/Fonte_07_Ragnatela_Attori_Interessi_Relazioni_Europa_2026-10-21_archi.csv",
      "row": 120,
      "original": {
        "id": "G-0122",
        "source": "UA",
        "target": "EV_TL-0006",
        "predicate": "VICTIM",
        "relation_class": "event_participation",
        "evidence_level": "E3",
        "evidence_status": "corroborato",
        "source_docs": "S06;S06,S00;S03;S05",
        "timeline_ids": "TL-0006",
        "date_start": "",
        "date_end": "",
        "primary_url": "",
        "layer": "timeline_link",
        "description_or_caveat": "Relazione di presenza/ruolo rispetto al record cronologico. Non inferisce di per sé coordinamento con altri attori."
      }
    }
  ]
}
