{
  "id": "G-0076",
  "subject": "XAI",
  "predicate": "CONTROLLA_INDIRETTAMENTE",
  "object": "X",
  "relation_class": "ownership",
  "evidence_level": "E3",
  "evidence_status": "corroborated",
  "events": [
    "TL-0099"
  ],
  "valid_from": null,
  "valid_to": null,
  "primary_url": null,
  "caveat": {
    "it": "Riferimento alla struttura riportata da S04"
  },
  "sources": [
    "S04"
  ],
  "review": {
    "status": "imported_unreviewed",
    "notes": []
  },
  "provenance": [
    {
      "file": "sources/original/Fonte_07_Ragnatela_Attori_Interessi_Relazioni_Europa_2026-10-21_archi.csv",
      "row": 74,
      "original": {
        "id": "G-0076",
        "source": "XAI",
        "target": "X",
        "predicate": "CONTROLLA_INDIRETTAMENTE",
        "relation_class": "ownership",
        "evidence_level": "E3",
        "evidence_status": "corroborato",
        "source_docs": "S04",
        "timeline_ids": "TL-0099",
        "date_start": "",
        "date_end": "",
        "primary_url": "",
        "layer": "source",
        "description_or_caveat": "Riferimento alla struttura riportata da S04"
      }
    }
  ]
}
