{
  "id": "G-0047",
  "subject": "BLACK",
  "predicate": "INDICATORI_TECNICI",
  "object": "ROKH",
  "relation_class": "influence",
  "evidence_level": "E3",
  "evidence_status": "corroborated",
  "events": [
    "TL-0113",
    "TL-0131"
  ],
  "valid_from": null,
  "valid_to": null,
  "primary_url": "https://www.sgdsn.gouv.fr/viginum/publications/rokh-solis-analyse-dun-mode-operatoire-informationnel-ayant-cible-les",
  "caveat": {
    "it": "Committente non identificato"
  },
  "sources": [
    "S01",
    "S02",
    "S05"
  ],
  "review": {
    "status": "imported_unreviewed",
    "notes": []
  },
  "provenance": [
    {
      "file": "sources/original/Fonte_07_Ragnatela_Attori_Interessi_Relazioni_Europa_2026-10-21_archi.csv",
      "row": 47,
      "original": {
        "id": "G-0047",
        "source": "BLACK",
        "target": "ROKH",
        "predicate": "INDICATORI_TECNICI",
        "relation_class": "influence",
        "evidence_level": "E3",
        "evidence_status": "corroborato",
        "source_docs": "S01,S02,S05",
        "timeline_ids": "TL-0113;TL-0131",
        "date_start": "",
        "date_end": "",
        "primary_url": "https://www.sgdsn.gouv.fr/viginum/publications/rokh-solis-analyse-dun-mode-operatoire-informationnel-ayant-cible-les",
        "layer": "source",
        "description_or_caveat": "Committente non identificato"
      }
    }
  ]
}
